{
  "id": "dnd35.race.gnoll",
  "name_es": "Gnoll",
  "source_family": "core_srd",
  "type": "humanoid_gnoll",
  "size": "medium",
  "speed_ft": 30,
  "ability_mods": {
    "str": 4,
    "con": 2,
    "int": -2,
    "cha": -2
  },
  "racial_hd": 2,
  "level_adjustment": 1,
  "minimum_starting_ecl": 3,
  "racial_hd_package": {
    "die": "d8",
    "bab": 1,
    "saves": {
      "fort": 3,
      "ref": 0,
      "will": 0
    },
    "feats": 1
  },
  "traits": [
    "darkvision_60_ft",
    "natural_armor_+1"
  ],
  "favored_class": "ranger",
  "languages": {
    "automatic": [
      "Gnoll"
    ],
    "bonus": [
      "Common",
      "Draconic",
      "Elven",
      "Goblin",
      "Orc"
    ]
  },
  "source_url": "https://www.d20srd.org/srd/monsters/gnoll.htm"
}
